video_id	video_title	video_description	video_thumbnail
HHIQp-cMrro	강아지 자랑하러 왔다가 양말 벗겨진 호민쿤[강형욱의개스트쇼] EP.5	셔틀콕 갖고 노는 말년이 폼 미쳤다 #강형욱 #주호민 #침착맨 #강아지 #선이 #셔틀콕 #반려견 #토크쇼 Copyright c 2023 Studio ...	https://i.ytimg.com/vi/HHIQp-cMrro/hqdefault.jpg
9xmqNrpO8bE	흘리고 보호자는 놀아주느라 땀 한 바가지 흘리고ㅣ견종백과 시베리안 허스키편	오늘 견종백과로 만나볼 친구는 시베리안 허스키입니다!   정말 잘생긴 외모를 갖고 있지만 미친듯한 털 빠짐과 엄청난 활동량도 갖고 ...	https://i.ytimg.com/vi/9xmqNrpO8bE/hqdefault.jpg
NBT2QrulQp8	참기름 강아지 | 견종백과 닥스훈트편	오늘 견종백과로 만나볼 친구는 닥스훈트입니다! 핫도그 같이 생겼다고 왕 하고 먹어버리면 안됩니다. ‍♂️ 또 봐요   00:00 ...	https://i.ytimg.com/vi/NBT2QrulQp8/hqdefault.jpg
XkHgmgsuv5E	사모예드 털 편 (털빠짐, 목욕고충, 한국더위)｜강형욱의 견종백과 X 극한견주 솜이 X 백곰이	[Eng sub/日本語字幕] 웹툰 '극한견주'의 마일로 작가님과 솜이, 백곰이 보호자님이 견종백과를 찾아주셨어요 'ㅅ' 사모예드는 털 ...	https://i.ytimg.com/vi/XkHgmgsuv5E/hqdefault.jpg
Bj6w-w21QXQ	산책 시 보호자를 끌고 다니는 요미를 위한 교육｜반려견 기초 상식	유료광고포함 강형욱 훈련사님이 알려주는 요미를 위한 산책교육! 집 안에서는 반려견과 보호자의 신뢰감을 쌓을 수 있는 '집 안 산책' ...	https://i.ytimg.com/vi/Bj6w-w21QXQ/hqdefault.jpg
pc4lILwieUU	포메라니안 편 2부｜강형욱의 견종백과	강형욱 훈련사님과 보호자님의 생활 밀착형 견종 수다! '강형욱의 견종백과' 견종마다 고유의 특성, 역사뿐만 아니라 현대사회로 오며 ...	https://i.ytimg.com/vi/pc4lILwieUU/hqdefault.jpg
J5q34GwAoB8	시바 이누(시바견) 2부｜강형욱의 견종백과 X 시바견곰이탱이여우	곰이탱이여우와 함께하는 견종백과 시바 이누 편 1부의 마라톤을 마치고(?) 본격적으로 시작되는 2부;;; ※ 나의 믹스견은 어떤 견종 ...	https://i.ytimg.com/vi/J5q34GwAoB8/hqdefault.jpg
XCWs7u8EZKk	중성화할 결심 | 견종백과 강형욱편	참고로 범인 이름은 영상 내에 안 나왔습니다… Shout out to ​⁠@1theKOriginals 영상 내 번역 자막은 유튜브 번역 No.1, 자메이크 ...	https://i.ytimg.com/vi/XCWs7u8EZKk/hqdefault.jpg
-Y7s_tm7SBo	닥스훈트 편 2부｜강형욱의 견종백과	견종마다 고유의 특성, 역사뿐만 아니라 현대사회로 오며 변화한 특성까지 리얼하게 들어볼 수 있는 강형욱 훈련사님과 보호자님들의 ...	https://i.ytimg.com/vi/-Y7s_tm7SBo/hqdefault.jpg
7qNnevIKY7c	보호소에서 입양 시 제일 먼저 해야하는 교육 [집에가자] EP.6	유기견 센터에서 가족을 기다리고 있는 강아지에게 입양 전 필요한 교육을 하는 [집에 가자] 이번 화 주인공은 '카라 아름품'에 있는 ...	https://i.ytimg.com/vi/7qNnevIKY7c/hqdefault.jpg
5VEAmk1hwyY	&quot;어렵게 모셨습니다&quot; 무려 1,000만 조회수를 기록한 강아지 &#39;촙촙이&#39; 근황 최초공개 [퍼피 근황올림픽]	견생 11개월, 촙촙이와 함께했습니다 교육 내용 1. 앉아 엎드려 교육 간식을 위로 올려서 앉아를 시키고 아래로 내리면서 엎드려를 ...	https://i.ytimg.com/vi/5VEAmk1hwyY/hqdefault.jpg
QWWvoX0rz2M	강형욱한테 가스라이팅 당하는 비글 구리 아빠 비투비 이창섭 [강형욱의개스트쇼] EP.11	기분 좋아지게 하는 구리 보고 가셔요 형욱 님 눈에서 하트나옴 구리야 예지앞사 ♥ (예전에도 지금도 앞으로도 사랑한다는 뜻ㅎ) ...	https://i.ytimg.com/vi/QWWvoX0rz2M/hqdefault.jpg
VZF0ST0-5vc	[Eng sub/日本語字幕] 골든 리트리버 2부｜강형욱의 견종백과 X 리틀라이언 레아레토	골든 리트리버 레아레토와 함께하는 견종백과 해맑은 골댕이의 우당탕탕 스튜디오 그 두 번 째 이야기! ※ 나의 믹스견은 어떤 견종 ...	https://i.ytimg.com/vi/VZF0ST0-5vc/hqdefault.jpg
aAGGqw3VhQQ	강형욱 훈련사도 매일 하는 분리불안 교육 ｜강형욱 X 대도서관	유료광고포함 강형욱 훈련사님도 매일 한다는 분리불안 교육!영상을 보면서 따라 해보세요! #엄억팁 #강형욱훈련사 #대도서관 #꼬 ...	https://i.ytimg.com/vi/aAGGqw3VhQQ/hqdefault.jpg
UXDls9YrwlY	강형욱 훈련사님과 강아지가 함께 달리는 개라톤 2019 댕댕런 in 상암!	2019 댕댕이 페스티벌 캠페인은 '내가 구해줄개 유기견'입니다. 보호자와 함께 신나게 달렸던 댕댕이들! 유기견들도 하루 빨리 좋은 ...	https://i.ytimg.com/vi/UXDls9YrwlY/hqdefault.jpg
3293XwJTRyg	시베리안 허스키 2부｜강형욱의 견종백과 X 노잼봇	노잼봇님과 함께하는 견종백과 시베리안 허스키 편 최초 견종백과에서 견종 퇴출...? ※ 나의 믹스견은 어떤 견종에 가까운지 알아보는 ...	https://i.ytimg.com/vi/3293XwJTRyg/hqdefault.jpg
tQ7utL5Km6w	반려견 자랑하랬더니 사기 치고 간 크러쉬 [강형욱의개스트쇼] EP.3	행욱이 핵주먹에 크러쉬 콩콩 맞았는디 두유가 주인 지키겠다고 왈왈 짖고 감 로즈는 두유가 짖든말든 쿨쿨 잠 #강형욱 #크러쉬 ...	https://i.ytimg.com/vi/tQ7utL5Km6w/hqdefault.jpg
jrO8TeJ50DI	사모예드 성격 편 (사회성,의심쟁이,사람이좋아)｜강형욱의 견종백과 X 극한견주 솜이 X 백곰이	[Eng sub/日本語字幕] 웹툰 '극한견주'의 마일로 작가님과 솜이, 백곰이 보호자님이 견종백과를 찾아주셨어요 'ㅅ' 강아지 운동장에 ...	https://i.ytimg.com/vi/jrO8TeJ50DI/hqdefault.jpg
UknHKXuM1Zw	김희선씨 그만 울고 가세요. 강아지 자랑하다 뿌듯해서 오열한 코리 엄마 희선씨 [강형욱의개스트쇼] EP.17	동안 비결 = DNA 또륵... 영상 내 번역 자막은 유튜브 번역 No.1, 자메이크에서 제작하였습니다. 유튜브 채널 성장의 시작은 자메이크 ...	https://i.ytimg.com/vi/UknHKXuM1Zw/hqdefault.jpg
